,0,1,2,3
0,Daniel Dennett,"Wherever there is a design that is highly successful in a broad range of similar environments, it is apt to emerge again and again, independently - the phenomenon known in biology as convergent evolution. I call these designs 'good tricks.'","[good, successful, evolution]",design
1,Iris Apfel,Fashion and interior design are one and the same.,"[fashion, interior, same]",design
2,David Carson,The dreaded phrase in design circles is 'show and tell.',"[circles, tell, show]",design
3,Kent Beck,Design should be easy in the sense that every step should be obviously and clearly identifiable. Simplify elements to make change simple so you can manage the technical risk.,"[change, simple, risk]",design
4,"Tyler, The Creator","I want to design jewelry for girls and guys... I'ma spread it out, but I'ma design, probably when I'm just designing furniture and buildings, I'll probably being the jewelry thing, too.","[jewelry, want, furniture]",design
5,Miguel de Cervantes,Delay always breeds danger; and to protract a great design is often to ruin it.,"[great, danger, always]",design
6,Samuel Johnson,Many things difficult to design prove easy to performance.,"[easy, performance, difficult]",design
7,Herbert Simon,Everyone designs who devises courses of action aimed at changing existing situations into preferred ones.,"[action, everyone, changing]",design
8,Pierre Bonnard,Color does not add a pleasant quality to design - it reinforces it.,"[quality, color, pleasant]",design
9,Harry Seidler,Good design doesn't date.,"[good, date]",design
10,Christian Louboutin,"I'm a designer, and I think if you work in fashion, you have to give people fantasy.","[work, people, fashion]",design
11,Henry Petroski,"All conventional wisdom has an element of truth to it, but good design requires more than an element of truth - it requires an ensemble of correct assumptions and valid calculations.","[wisdom, truth, good]",design
12,Dennis Conner,Design has taken the place of what sailing used to be.,"[sailing, place, used]",design
13,Carson McCullers,"The mind is like a richly woven tapestry in which the colors are distilled from the experiences of the senses, and the design drawn from the convolutions of the intellect.","[mind, colors, experiences]",design
14,Les Brown,"We must look for ways to be an active force in our own lives. We must take charge of our own destinies, design a life of substance and truly begin to live our dreams.","[life, dreams, live]",design
15,Robert McKee,Classical design is a mirror of the human mind. It's how we see the world.,"[mind, mirror, world]",design
16,Skrillex,"Hip-hop and electronic music are so similar, in the fact that they're both very visceral, have so much bass; a lot of times, it's the same tempos. The culture and some of the sound design is different but a lot of times, it's the same stuff.","[music, culture, hip-hop]",design
17,Christian Louboutin,"I have no problem with the idea of comfort, but it is not an important thing aesthetically. If you look at a shoe and immediately say it looks very comfortable, in terms of design, it is not going to excite me. Of course, I am not putting nails in my shoes to ensure everybody is in pain, but a heel is not a pair of slippers and never will be.","[pain, i am, shoes]",design
18,James Wan,"For me, the sound design and the musical score is a big part of what makes scary movies work.","[work, me, movies]",design
19,P. J. O'Rourke,"The great majority of Baghdad is a slum - a lot of it's new, but it's still slum. It's usually this concrete-block, one-room design with a door and a window, arranged one-up, one-down, often with a shop with nothing in it on the first floor, and then a one-room apartment above it. There's street after street after street of that stuff.","[great, door, window]",design
20,Billy Graham,"Many churches of all persuasions are hiring research agencies to poll neighborhoods, asking what kind of church they prefer. Then the local churches design themselves to fit the desires of the people. True faith in God that demands selflessness is being replaced by trendy religion that serves the selfish.","[god, faith, religion]",design
21,Greg Anderson,"Wellness is not a 'medical fix' but a way of living - a lifestyle sensitive and responsive to all the dimensions of body, mind, and spirit, an approach to life we each design to achieve our highest potential for well-being now and forever.","[life, mind, medical]",design
22,Michael Graves,Good design should be available to everyone - and I do mean everyone. What I spent on the wheelchair I'm in could buy a small Mercedes. It's not only unfair to me; it's unfair to someone who's indigent but has the same needs. My goal is to make all objects affordable.,"[good, goal, small]",design
23,Jean Cocteau,"The actual tragedies of life bear no relation to one's preconceived ideas. In the event, one is always bewildered by their simplicity, their grandeur of design, and by that element of the bizarre which seems inherent in them.","[life, simplicity, ideas]",design
24,Adam Ferguson,"Every step and every movement of the multitude, even in what are termed enlightened ages, are made with equal blindness to the future; and nations stumble upon establishments, which are indeed the result of human action, but not the execution of any human design.","[future, step, action]",design
25,Stockwell Day,"As all human beings are, in my view, creatures of God's design, we must respect all other human beings. That does not mean I have to agree with their choices or agree with their opinions, but indeed I respect them as human beings.","[respect, god, choices]",design
